{
 "nome": "greenagumo-e1",
 "formato": "bedrock",
 "resolucao": {
  "largura": 64,
  "altura": 64
 },
 "ossos": [
  {
   "nome": "root",
   "pai": null,
   "pivo": [
    0,
    0,
    0
   ]
  },
  {
   "nome": "body",
   "pai": "root",
   "pivo": [
    0.0,
    5.0,
    0.5
   ]
  },
  {
   "nome": "feather_left",
   "pai": "body",
   "pivo": [
    -5.0,
    11.5,
    0.0
   ]
  },
  {
   "nome": "eye_left",
   "pai": "body",
   "pivo": [
    -2.5,
    6.0,
    -6.01
   ]
  },
  {
   "nome": "mouth",
   "pai": "body",
   "pivo": [
    0.0,
    4.0,
    -6.01
   ]
  },
  {
   "nome": "gem",
   "pai": "body",
   "pivo": [
    0.0,
    8.0,
    -5.01
   ]
  },
  {
   "nome": "feather_right",
   "pai": "body",
   "pivo": [
    5.0,
    11.5,
    0.0
   ]
  },
  {
   "nome": "eye_right",
   "pai": "body",
   "pivo": [
    2.5,
    6.0,
    -6.01
   ]
  }
 ],
 "cubos": [
  {
   "nome": "body_cube",
   "osso": "body",
   "parte": "body",
   "tipo": "volume",
   "from": [
    -6.0,
    0.0,
    -5.0
   ],
   "to": [
    6.0,
    3.0,
    7.0
   ],
   "cor": "#48b8b8",
   "uv_offset": [
    0,
    18
   ]
  },
  {
   "nome": "body_cube_2",
   "osso": "body",
   "parte": "body",
   "tipo": "volume",
   "from": [
    -6.5,
    3.0,
    -6.0
   ],
   "to": [
    6.5,
    7.0,
    7.0
   ],
   "cor": "#48b8b8",
   "uv_offset": [
    0,
    0
   ]
  },
  {
   "nome": "body_cube_3",
   "osso": "body",
   "parte": "body",
   "tipo": "volume",
   "from": [
    -5.5,
    7.0,
    -5.0
   ],
   "to": [
    5.5,
    10.0,
    6.0
   ],
   "cor": "#48b8b8",
   "uv_offset": [
    0,
    34
   ]
  },
  {
   "nome": "feather_left_cube",
   "osso": "feather_left",
   "parte": "feather_left",
   "tipo": "plano",
   "from": [
    -10.0,
    9.0,
    0.0
   ],
   "to": [
    0.0,
    14.0,
    0.0
   ],
   "cor": "#48a8a8",
   "uv_offset": [
    0,
    49
   ]
  },
  {
   "nome": "eye_left_cube",
   "osso": "eye_left",
   "parte": "eye_left",
   "tipo": "adesivo",
   "from": [
    -4.0,
    5.0,
    -6.01
   ],
   "to": [
    -1.0,
    7.0,
    -6.01
   ],
   "cor": "#b07020",
   "uv_offset": [
    44,
    49
   ]
  },
  {
   "nome": "mouth_cube",
   "osso": "mouth",
   "parte": "mouth",
   "tipo": "adesivo",
   "from": [
    -5.5,
    3.0,
    -6.01
   ],
   "to": [
    5.5,
    5.0,
    -6.01
   ],
   "cor": "#1a2a2a",
   "uv_offset": [
    21,
    49
   ]
  },
  {
   "nome": "gem_cube",
   "osso": "gem",
   "parte": "gem",
   "tipo": "adesivo",
   "from": [
    -0.5,
    7.0,
    -5.01
   ],
   "to": [
    0.5,
    9.0,
    -5.01
   ],
   "cor": "#e8b858",
   "uv_offset": [
    51,
    49
   ]
  },
  {
   "nome": "feather_right_cube",
   "osso": "feather_right",
   "parte": "feather_right",
   "tipo": "plano",
   "from": [
    -0.0,
    9.0,
    0.0
   ],
   "to": [
    10.0,
    14.0,
    0.0
   ],
   "cor": "#48a8a8",
   "mirror_uv": true,
   "uv_offset": [
    0,
    49
   ]
  },
  {
   "nome": "eye_right_cube",
   "osso": "eye_right",
   "parte": "eye_right",
   "tipo": "adesivo",
   "from": [
    1.0,
    5.0,
    -6.01
   ],
   "to": [
    4.0,
    7.0,
    -6.01
   ],
   "cor": "#b07020",
   "mirror_uv": true,
   "uv_offset": [
    44,
    49
   ]
  }
 ],
 "locators": [
  {
   "nome": "loc_eye_left",
   "osso": "eye_left",
   "posicao": [
    -2.5,
    6.0,
    -6.11
   ]
  },
  {
   "nome": "loc_eye_right",
   "osso": "eye_right",
   "posicao": [
    2.5,
    6.0,
    -6.11
   ]
  },
  {
   "nome": "loc_center",
   "osso": "body",
   "posicao": [
    0.0,
    5.0,
    0.5
   ]
  },
  {
   "nome": "loc_top",
   "osso": "body",
   "posicao": [
    0.0,
    16.0,
    0.5
   ]
  },
  {
   "nome": "loc_ground",
   "osso": "body",
   "posicao": [
    0.0,
    0.0,
    0.5
   ]
  }
 ],
 "orcamento": {
  "cubos": 9,
  "p75": 52,
  "limite": 67.6
 }
}
